Name,Context,Quote
Justin Sun,"On the potential of blockchain and TRON","Blockchain will revolutionize the world, and TRON will be at the forefront of that revolution."
Justin Sun,"Discussing the importance of decentralization","Decentralization is the key to unlocking a new era of freedom and opportunity."
Justin Sun,"Emphasizing the need for innovation","We must challenge the status quo and strive for innovation in all aspects of life."
Justin Sun,"Motivating individuals to pursue their dreams","Dream big, work hard, and never stop believing in yourself."
Justin Sun,"Reflecting on the value of perseverance","Success is not final, failure is not fatal: it is the courage to continue that counts."
Justin Sun,"Highlighting TRON's mission","The future is decentralized, and we are building that future today."
Justin Sun,"Underlining the transformative power of blockchain","Blockchain has the potential to empower individuals and transform industries."
Justin Sun,"Stressing the importance of disruptive thinking","Innovation is born out of disruption and a relentless pursuit of improvement."
Justin Sun,"Encouraging resilience in the face of challenges","Every setback is an opportunity to learn and grow stronger."
Justin Sun,"Adapting to changes in the digital landscape","Embrace change, adapt quickly, and thrive in the evolving digital landscape."
Justin Sun,"Recognizing the strength of a united community","The power of community is unparalleled in driving progress and achieving greatness."
Justin Sun,"Encouraging individuals to overcome self-imposed limits","The only limits we have are the ones we impose on ourselves."
Justin Sun,"Highlighting the potential of blockchain for financial inclusion","Blockchain technology has the potential to bring financial inclusion to the unbanked."
Justin Sun,"Expressing the mission to democratize content creation","We are on a mission to democratize content creation and distribution."
Justin Sun,"Recognizing the value of empowering individuals in a decentralized ecosystem","The true value of a decentralized ecosystem lies in its ability to empower individuals."
Justin Sun,"Emphasizing the importance of innovation and challenging conventions","The future belongs to those who dare to challenge convention and embrace innovation."
Justin Sun,"Motivating individuals to pursue their dreams with courage","Every great achievement starts with a dream and the courage to pursue it."
Justin Sun,"Highlighting the importance of transparency in the digital age","Transparency is the foundation of trust in the digital age."
Justin Sun,"Recognizing the strength of a passionate and united community","Never underestimate the power of a passionate and united community."
Justin Sun,"Advocating for education and awareness in blockchain adoption","Education and awareness are vital in driving mass adoption of blockchain technology."
Justin Sun,"Defining entrepreneurship as an opportunity for positive impact","Entrepreneurship is about turning challenges into opportunities and making a positive impact."
Justin Sun,"Promoting the creation of the future through proactive actions","The best way to predict the future is to create it."
Justin Sun,"Describing the vision of a decentralized internet","We are building a decentralized internet that empowers individuals and preserves privacy."
Justin Sun,"Recognizing the power of decentralization in distributing power","In a decentralized world, the power lies in the hands of the many, not the few."
Justin Sun,"Acknowledging the unpredictable nature of the journey to success","The journey to success is never linear; it is filled with twists and turns."
Justin Sun,"Emphasizing the importance of pushing boundaries for great achievements","The greatest achievements often come from pushing the boundaries of what is possible."
Justin Sun,"Highlighting the purpose of technology to enhance lives","Technology should serve humanity and enhance our lives."
Justin Sun,"Recognizing the potential of blockchain in the digital revolution","The digital revolution is just beginning, and blockchain will be its catalyst."
Justin Sun,"Stressing the importance of staying true to one's vision and values","Never lose sight of your vision, and never compromise on your values."
Justin Sun,"Highlighting the power of collaboration and partnerships","Collaboration and partnerships are essential in driving innovation and creating a sustainable future."
Justin Sun,"Defining true leadership and fostering growth and excellence","True leaders empower others to succeed and foster a culture of growth and excellence."
Justin Sun,"Describing blockchain as a catalyst for positive change","The blockchain is a tool for empowerment and a catalyst for positive change."
Justin Sun,"Emphasizing the need for action to achieve dreams","It's not enough to dream big; you must also take action to turn those dreams into reality."
Justin Sun,"Highlighting the growth opportunities hidden within challenges","Challenges are opportunities in disguise; they push us to grow and evolve."
Justin Sun,"Recognizing innovation as a driving force for progress","Innovation is the driving force behind progress and the key to staying ahead of the curve."
Justin Sun,"Encouraging resilience and growth through failure","Never be afraid to fail; it is through failure that we learn, adapt, and grow."
Justin Sun,"Describing blockchain as a digital revolution","The blockchain is a digital revolution that will reshape industries and empower individuals."
Justin Sun,"Recognizing the need to build infrastructure for a decentralized future","The future is decentralized, and we are building the infrastructure to support it."
Justin Sun,"Defining success beyond material wealth","Success is not measured by wealth alone, but by the positive impact we make in the world."
Justin Sun,"Highlighting the ability of blockchain to level the playing field","The blockchain has the potential to level the playing field and give everyone a fair chance."
Justin Sun,"Recognizing the importance of a passionate and dedicated team","Never underestimate the power of a passionate and dedicated team."
Justin Sun,"Highlighting the long-term commitment and perseverance required for success","Remember, success is not an overnight achievement; it is the result of years of hard work and perseverance."
